{
  "schemaVersion": 1,
  "target": "apple2e",
  "output": "asset-c-demo.po",
  "disk": { "fileSystem": "prodos", "volumeName": "ASSETC" },
  "cc65": { "compiler": "cl65", "target": "apple2" },
  "assets": [{
    "name": "ATLAS",
    "source": "assets/atlas.png",
    "output": "generated/atlas.bin",
    "kind": "sprite",
    "cellWidth": 7,
    "cellHeight": 8,
    "cHeader": "generated/atlas.h",
    "metadataOutput": "generated/atlas.json"
  }],
  "files": [{ "source": "asset-data.c", "path": "DEMO", "kind": "cc65" }]
}
